{
  "version": 1,
  "id": "expand_full_word_reuse",
  "rlimit_nofile": 96,
  "ops": [
    {
      "op": "eventfd2",
      "init": 0,
      "flags": 2048
    },
    {
      "op": "dup",
      "fd": {
        "ref": 0
      }
    },
    {
      "op": "dup",
      "fd": {
        "ref": 0
      }
    },
    {
      "op": "dup",
      "fd": {
        "ref": 0
      }
    },
    {
      "op": "dup",
      "fd": {
        "ref": 0
      }
    },
    {
      "op": "dup",
      "fd": {
        "ref": 0
      }
    },
    {
      "op": "dup",
      "fd": {
        "ref": 0
      }
    },
    {
      "op": "dup",
      "fd": {
        "ref": 0
      }
    },
    {
      "op": "dup",
      "fd": {
        "ref": 0
      }
    },
    {
      "op": "dup",
      "fd": {
        "ref": 0
      }
    },
    {
      "op": "dup",
      "fd": {
        "ref": 0
      }
    },
    {
      "op": "dup",
      "fd": {
        "ref": 0
      }
    },
    {
      "op": "dup",
      "fd": {
        "ref": 0
      }
    },
    {
      "op": "dup",
      "fd": {
        "ref": 0
      }
    },
    {
      "op": "dup",
      "fd": {
        "ref": 0
      }
    },
    {
      "op": "dup",
      "fd": {
        "ref": 0
      }
    },
    {
      "op": "dup",
      "fd": {
        "ref": 0
      }
    },
    {
      "op": "dup",
      "fd": {
        "ref": 0
      }
    },
    {
      "op": "dup",
      "fd": {
        "ref": 0
      }
    },
    {
      "op": "dup",
      "fd": {
        "ref": 0
      }
    },
    {
      "op": "dup",
      "fd": {
        "ref": 0
      }
    },
    {
      "op": "dup",
      "fd": {
        "ref": 0
      }
    },
    {
      "op": "dup",
      "fd": {
        "ref": 0
      }
    },
    {
      "op": "dup",
      "fd": {
        "ref": 0
      }
    },
    {
      "op": "dup",
      "fd": {
        "ref": 0
      }
    },
    {
      "op": "dup",
      "fd": {
        "ref": 0
      }
    },
    {
      "op": "dup",
      "fd": {
        "ref": 0
      }
    },
    {
      "op": "dup",
      "fd": {
        "ref": 0
      }
    },
    {
      "op": "dup",
      "fd": {
        "ref": 0
      }
    },
    {
      "op": "dup",
      "fd": {
        "ref": 0
      }
    },
    {
      "op": "dup",
      "fd": {
        "ref": 0
      }
    },
    {
      "op": "dup",
      "fd": {
        "ref": 0
      }
    },
    {
      "op": "dup",
      "fd": {
        "ref": 0
      }
    },
    {
      "op": "dup",
      "fd": {
        "ref": 0
      }
    },
    {
      "op": "dup",
      "fd": {
        "ref": 0
      }
    },
    {
      "op": "dup",
      "fd": {
        "ref": 0
      }
    },
    {
      "op": "dup",
      "fd": {
        "ref": 0
      }
    },
    {
      "op": "dup",
      "fd": {
        "ref": 0
      }
    },
    {
      "op": "dup",
      "fd": {
        "ref": 0
      }
    },
    {
      "op": "dup",
      "fd": {
        "ref": 0
      }
    },
    {
      "op": "dup",
      "fd": {
        "ref": 0
      }
    },
    {
      "op": "dup",
      "fd": {
        "ref": 0
      }
    },
    {
      "op": "dup",
      "fd": {
        "ref": 0
      }
    },
    {
      "op": "dup",
      "fd": {
        "ref": 0
      }
    },
    {
      "op": "dup",
      "fd": {
        "ref": 0
      }
    },
    {
      "op": "dup",
      "fd": {
        "ref": 0
      }
    },
    {
      "op": "dup",
      "fd": {
        "ref": 0
      }
    },
    {
      "op": "dup",
      "fd": {
        "ref": 0
      }
    },
    {
      "op": "dup",
      "fd": {
        "ref": 0
      }
    },
    {
      "op": "dup",
      "fd": {
        "ref": 0
      }
    },
    {
      "op": "dup",
      "fd": {
        "ref": 0
      }
    },
    {
      "op": "dup",
      "fd": {
        "ref": 0
      }
    },
    {
      "op": "dup",
      "fd": {
        "ref": 0
      }
    },
    {
      "op": "dup",
      "fd": {
        "ref": 0
      }
    },
    {
      "op": "dup",
      "fd": {
        "ref": 0
      }
    },
    {
      "op": "dup",
      "fd": {
        "ref": 0
      }
    },
    {
      "op": "dup",
      "fd": {
        "ref": 0
      }
    },
    {
      "op": "dup",
      "fd": {
        "ref": 0
      }
    },
    {
      "op": "dup",
      "fd": {
        "ref": 0
      }
    },
    {
      "op": "dup",
      "fd": {
        "ref": 0
      }
    },
    {
      "op": "dup",
      "fd": {
        "ref": 0
      }
    },
    {
      "op": "dup",
      "fd": {
        "ref": 0
      }
    },
    {
      "op": "dup",
      "fd": {
        "ref": 0
      }
    },
    {
      "op": "close",
      "fd": {
        "literal": 40
      }
    }
  ]
}
